{
  "agents": [],
  "checks": [],
  "decisions": [],
  "failing": null,
  "files_edited": [],
  "files_read": [],
  "files_touched": [],
  "git": null,
  "goal": "",
  "handoffs": [],
  "interrupted": null,
  "last_actions": [],
  "last_actions_shown": [],
  "last_report": "",
  "last_report_agent": null,
  "last_report_at": null,
  "last_session": null,
  "latest_request": "",
  "next_action": "",
  "started": "2026-10-14T12:00:00Z",
  "status": "active",
  "steering": [],
  "stuck": null,
  "summary": null,
  "task_id": "t_20261014_120000000000",
  "unknown_exit": [],
  "updated": "2026-10-14T12:00:00Z",
  "usage": {},
  "v": 1
}
