{
  "agents": [
    {
      "agent": "codex",
      "session": "01a13fcf-cfdf-7582-8790-29210a9b34f3",
      "transcript": "~/.codex/sessions/2026/10/15/rollout-01a13fcf-cfdf-7582-8790-29210a9b34f3.jsonl",
      "turns": 2
    },
    {
      "agent": "claude-code",
      "session": "5e43db48-1979-4b21-8fb6-7c90a0b414f0",
      "transcript": "~/.claude/projects/-projects-hello/5e43db48-1979-4b21-8fb6-7c90a0b414f0.jsonl",
      "turns": 1
    }
  ],
  "checks": [],
  "decisions": [],
  "failing": {
    "command": "python3 -c \"raise SystemExit(7)\"",
    "exit": 7,
    "tail": ""
  },
  "files_edited": [
    "hello.py"
  ],
  "files_read": [],
  "files_touched": [
    "hello.py"
  ],
  "git": null,
  "goal": "Use your update_plan tool to make exactly this 3-step plan: \"Write hello.py\", \"Run it\", \"Add a failing check\". Then do step 1 only: create hello.py that prints \"hello autosave\".",
  "handoffs": [
    {
      "at": "2026-10-15T13:53:46.908482Z",
      "from": "codex",
      "reason": "paused",
      "to": "claude-code"
    }
  ],
  "interrupted": null,
  "last_actions": [
    "Ran python3 -c \"raise SystemExit(7)\" (exit 7)",
    "Ran python3 hello.py (exit 0)",
    "Edited hello.py"
  ],
  "last_actions_shown": [
    "Ran python3 -c \"raise SystemExit(7)\" (exit 7)",
    "Ran python3 hello.py (exit 0)",
    "Edited hello.py"
  ],
  "last_report": "`python3 hello.py` printed `hello autosave`.\n\n`python3 -c \"raise SystemExit(7)\"` exited with code 7. Stopped without fixing it.",
  "last_report_agent": "codex",
  "last_report_at": "2026-10-15T13:48:36.721917Z",
  "last_session": {
    "agent": "claude-code",
    "ended": true,
    "session": "5e43db48-1979-4b21-8fb6-7c90a0b414f0"
  },
  "latest_request": "What did the agent-autosave context at session start tell you?",
  "next_action": "Make `python3 -c \"raise SystemExit(7)\"` pass.",
  "notes": [
    {
      "text": "Step 1 is done: hello.py prints hello autosave. Next: run python3 hello.py, then the failing check python3 -c \"raise SystemExit(7)\". Nothing risky in flight.",
      "type": "handoff"
    }
  ],
  "plan": [
    {
      "state": "done",
      "step": "Write hello.py"
    },
    {
      "state": "done",
      "step": "Run it"
    },
    {
      "state": "todo",
      "step": "Add a failing check"
    }
  ],
  "started": "2026-10-15T13:46:06.466746Z",
  "status": "paused",
  "steering": [
    "Run python3 hello.py. Then run python3 -c \"raise SystemExit(7)\" and stop there; do not fix it.",
    "What did the agent-autosave context at session start tell you?"
  ],
  "stuck": null,
  "summary": null,
  "task_id": "t_20261015_134606466746",
  "unknown_exit": [],
  "updated": "2026-10-15T13:54:14.687664Z",
  "usage": {
    "codex": {
      "at": "2026-10-15T13:48:36.721916Z",
      "context_pct": 34.9,
      "crossed_at": "2026-10-15T13:47:45.827143Z",
      "handoff_at": "2026-10-15T13:48:07.702110Z",
      "limit_pct": 91.0,
      "limit_resets_at": "2026-10-15T16:26:06Z",
      "limit_window_minutes": 300,
      "session": "01a13fcf-cfdf-7582-8790-29210a9b34f3",
      "weekly_pct": 42.0
    }
  },
  "v": 1
}
