{
  "agents": [
    {
      "agent": "claude-code",
      "session": "5145dfc5-3aa4-4543-880d-5fabc745c93b",
      "transcript": "~/.claude/projects/-projects-hello/5145dfc5-3aa4-4543-880d-5fabc745c93b.jsonl",
      "turns": 2
    },
    {
      "agent": "codex",
      "session": "01a13fd6-da45-7381-aa2c-03b3674f1527",
      "transcript": "~/.codex/sessions/2026/10/15/rollout-01a13fd6-da45-7381-aa2c-03b3674f1527.jsonl",
      "turns": 1
    }
  ],
  "checks": [],
  "decisions": [],
  "failing": {
    "command": "python3 -c \"raise SystemExit(7)\"",
    "exit": 7,
    "tail": "Exit code 7"
  },
  "files_edited": [
    "hello.py"
  ],
  "files_read": [],
  "files_touched": [
    "hello.py"
  ],
  "git": null,
  "goal": "Use your todo/task tool to make a 3-step plan: write hello.py, run it, add a failing check. Then do step 1 only: write hello.py that prints \"hello autosave\".",
  "handoffs": [
    {
      "at": "2026-10-15T02:03:42.831319Z",
      "from": "claude-code",
      "reason": "rate_limit",
      "to": "codex"
    }
  ],
  "interrupted": null,
  "last_actions": [
    "Ran python3 -c \"raise SystemExit(7)\" (exit 7)",
    "Ran python3 hello.py (exit 0)",
    "Wrote hello.py"
  ],
  "last_actions_shown": [
    "Ran python3 -c \"raise SystemExit(7)\" (exit 7)",
    "Ran python3 hello.py (exit 0)",
    "Wrote hello.py"
  ],
  "last_report": "I wrote `hello.py`, which prints `hello autosave`. That finishes step 1. I haven't run it, because that's step 2.\n\nWhat's left:\n- [x] 1. Write `hello.py`\n- [ ] 2. Run it\n- [ ] 3. Add a failing check",
  "last_report_agent": "claude-code",
  "last_report_at": "2026-10-15T01:58:49.006784Z",
  "last_session": {
    "agent": "codex",
    "ended": true,
    "session": "01a13fd6-da45-7381-aa2c-03b3674f1527"
  },
  "latest_request": "What did the agent-autosave context at session start tell you?",
  "next_action": "Make `python3 -c \"raise SystemExit(7)\"` pass.",
  "plan": [
    {
      "state": "done",
      "step": "Write `hello.py`"
    },
    {
      "state": "todo",
      "step": "Run it"
    },
    {
      "state": "todo",
      "step": "Add a failing check"
    }
  ],
  "started": "2026-10-15T01:58:33.789533Z",
  "status": "paused",
  "steering": [
    "Run python3 hello.py. Then run python3 -c \"raise SystemExit(7)\" and stop there; do not fix it.",
    "What did the agent-autosave context at session start tell you?"
  ],
  "stuck": null,
  "summary": null,
  "task_id": "t_20261015_015833789533",
  "unknown_exit": [],
  "updated": "2026-10-15T02:05:57.477033Z",
  "usage": {},
  "v": 1
}
