{
  "agents": [
    {
      "agent": "claude-code",
      "session": "session-a",
      "transcript": null,
      "turns": 3
    }
  ],
  "checks": [
    {
      "at": "2026-10-14T12:00:01Z",
      "command": "pytest",
      "exit": 1
    }
  ],
  "decisions": [
    "Use https://[redacted:url_credentials]@example.com safely"
  ],
  "failing": {
    "command": "pytest",
    "exit": 1,
    "tail": "[redacted:assignment]\n[redacted:bearer]"
  },
  "files_edited": [],
  "files_read": [],
  "files_touched": [],
  "git": null,
  "goal": "Build client with [redacted:api_key] safely.",
  "handoffs": [],
  "interrupted": null,
  "last_actions": [
    "Ran pytest (exit 1)"
  ],
  "last_actions_shown": [
    "Ran pytest (exit 1)"
  ],
  "last_report": "",
  "last_report_agent": null,
  "last_report_at": null,
  "last_session": {
    "agent": "claude-code",
    "ended": false,
    "session": "session-a"
  },
  "latest_request": "",
  "memory_notes": [
    {
      "agent": "claude-code",
      "at": "2026-10-14T12:00:02Z",
      "text": "Use https://[redacted:url_credentials]@example.com safely",
      "type": "decision"
    }
  ],
  "next_action": "Make `pytest` pass.",
  "started": "2026-10-14T12:00:00Z",
  "status": "active",
  "steering": [],
  "stuck": null,
  "summary": null,
  "task_id": "t_20261014_120000000000",
  "unknown_exit": [],
  "updated": "2026-10-14T12:00:02Z",
  "usage": {},
  "v": 1
}
