{
  "agents": [
    {
      "agent": "claude-code",
      "session": "session-a",
      "transcript": "/logs/a.jsonl",
      "turns": 4
    },
    {
      "agent": "codex",
      "session": "b",
      "transcript": null,
      "turns": 1
    }
  ],
  "checks": [],
  "decisions": [],
  "failing": null,
  "files_edited": [
    "compiler.py"
  ],
  "files_read": [],
  "files_touched": [
    "compiler.py"
  ],
  "git": null,
  "goal": "Build a reliable portable autosave compiler.",
  "handoffs": [
    {
      "at": "2026-10-14T12:00:02Z",
      "from": "claude-code",
      "reason": "rate_limit",
      "to": "codex"
    },
    {
      "at": "2026-10-14T12:00:03Z",
      "from": "codex",
      "reason": "active",
      "to": "claude-code"
    }
  ],
  "interrupted": null,
  "last_actions": [
    "Wrote compiler"
  ],
  "last_actions_shown": [
    "Wrote compiler"
  ],
  "last_report": "",
  "last_report_agent": null,
  "last_report_at": null,
  "last_session": {
    "agent": "claude-code",
    "ended": false,
    "session": "session-a"
  },
  "latest_request": "",
  "next_action": "Build a reliable portable autosave compiler.",
  "started": "2026-10-14T12:00:00Z",
  "status": "active",
  "steering": [],
  "stuck": null,
  "summary": null,
  "task_id": "t_20261014_120000000000",
  "unknown_exit": [],
  "updated": "2026-10-14T12:00:04Z",
  "usage": {},
  "v": 1
}
