{
  "agents": [
    {
      "agent": "codex",
      "session": "01a13fcf-cfdf-7582-8790-29210a9b34f3",
      "transcript": "~/.codex/sessions/2026/10/15/rollout-01a13fcf-cfdf-7582-8790-29210a9b34f3.jsonl",
      "turns": 2
    }
  ],
  "checks": [],
  "decisions": [
    "hello.py prints with print(), not logging, so a check can read its stdout"
  ],
  "failing": {
    "command": "python3 -c \"raise SystemExit(7)\"",
    "exit": 7,
    "tail": ""
  },
  "files_edited": [
    "hello.py"
  ],
  "files_read": [],
  "files_touched": [
    "hello.py"
  ],
  "git": null,
  "goal": "Use your update_plan tool to make exactly this 3-step plan: \"Write hello.py\", \"Run it\", \"Add a failing check\". Then do step 1 only: create hello.py that prints \"hello autosave\".",
  "handoffs": [],
  "interrupted": null,
  "last_actions": [
    "Ran python3 -c \"raise SystemExit(7)\" (exit 7)",
    "Ran python3 hello.py (exit 0)",
    "Edited hello.py"
  ],
  "last_actions_shown": [
    "Ran python3 -c \"raise SystemExit(7)\" (exit 7)",
    "Ran python3 hello.py (exit 0)",
    "Edited hello.py"
  ],
  "last_report": "`python3 hello.py` printed `hello autosave`.\n\n`python3 -c \"raise SystemExit(7)\"` exited with code 7. Stopped without fixing it.",
  "last_report_agent": "codex",
  "last_report_at": "2026-10-15T13:48:36.721916Z",
  "last_session": {
    "agent": "codex",
    "ended": true,
    "session": "01a13fcf-cfdf-7582-8790-29210a9b34f3"
  },
  "latest_request": "Run python3 hello.py. Then run python3 -c \"raise SystemExit(7)\" and stop there; do not fix it.",
  "memory_notes": [
    {
      "agent": "codex",
      "at": "2026-10-15T13:48:30.000000Z",
      "text": "hello.py prints with print(), not logging, so a check can read its stdout",
      "type": "decision"
    }
  ],
  "next_action": "Nothing: the task is finished.",
  "plan": [
    {
      "state": "done",
      "step": "Write hello.py"
    },
    {
      "state": "done",
      "step": "Run it"
    },
    {
      "state": "todo",
      "step": "Add a failing check"
    }
  ],
  "started": "2026-10-15T13:46:06.466746Z",
  "status": "done",
  "steering": [
    "Run python3 hello.py. Then run python3 -c \"raise SystemExit(7)\" and stop there; do not fix it."
  ],
  "stuck": null,
  "summary": null,
  "task_id": "t_20261015_134606466746",
  "unknown_exit": [],
  "updated": "2026-10-15T13:51:10.000000Z",
  "usage": {},
  "v": 1
}
