{
  "agents": [
    {
      "agent": "claude-code",
      "session": "session-a",
      "transcript": null,
      "turns": 2
    }
  ],
  "checks": [],
  "decisions": [],
  "failing": null,
  "files_edited": [
    "source.py"
  ],
  "files_read": [],
  "files_touched": [
    "source.py",
    "file-0.py",
    "file-1.py",
    "file-2.py",
    "file-3.py",
    "file-4.py",
    "file-5.py",
    "file-6.py",
    "file-7.py",
    "file-8.py",
    "file-9.py",
    "file-10.py",
    "file-11.py",
    "file-12.py",
    "file-13.py",
    "file-14.py",
    "file-15.py",
    "file-16.py",
    "file-17.py",
    "file-18.py",
    "file-19.py",
    "file-20.py",
    "file-21.py",
    "file-22.py",
    "file-23.py",
    "file-24.py",
    "file-25.py",
    "file-26.py",
    "file-27.py",
    "file-28.py"
  ],
  "git": {
    "branch": "main",
    "commits_since_start": 2,
    "diffstat": "2 files changed, 3 insertions(+)",
    "dirty": [
      "source.py",
      "file-0.py",
      "file-1.py",
      "file-2.py",
      "file-3.py",
      "file-4.py",
      "file-5.py",
      "file-6.py",
      "file-7.py",
      "file-8.py",
      "file-9.py",
      "file-10.py",
      "file-11.py",
      "file-12.py",
      "file-13.py",
      "file-14.py",
      "file-15.py",
      "file-16.py",
      "file-17.py",
      "file-18.py",
      "file-19.py",
      "file-20.py",
      "file-21.py",
      "file-22.py",
      "file-23.py",
      "file-24.py",
      "file-25.py",
      "file-26.py",
      "file-27.py",
      "file-28.py",
      "file-29.py",
      "file-30.py",
      "file-31.py",
      "file-32.py",
      "file-33.py",
      "file-34.py"
    ],
    "head": "aaaaaaaaaaaaaaaaaaaaaaaaaaaaaaaaaaaaaaaa"
  },
  "goal": "Build a reliable portable autosave compiler.",
  "handoffs": [],
  "interrupted": null,
  "last_actions": [
    "Edited source"
  ],
  "last_actions_shown": [
    "Edited source"
  ],
  "last_report": "",
  "last_report_agent": null,
  "last_report_at": null,
  "last_session": {
    "agent": "claude-code",
    "ended": false,
    "session": "session-a"
  },
  "latest_request": "",
  "next_action": "Build a reliable portable autosave compiler.",
  "started": "2026-10-14T12:00:00Z",
  "status": "active",
  "steering": [],
  "stuck": null,
  "summary": null,
  "task_id": "t_20261014_120000000000",
  "unknown_exit": [],
  "updated": "2026-10-14T12:00:01Z",
  "usage": {},
  "v": 1
}
