{
  "agents": [
    {
      "agent": "claude-code",
      "session": "session-a",
      "transcript": null,
      "turns": 1
    }
  ],
  "checks": [],
  "decisions": [],
  "failing": null,
  "files_edited": [],
  "files_read": [],
  "files_touched": [],
  "git": null,
  "goal": "The new task starts with this goal.",
  "handoffs": [],
  "interrupted": null,
  "last_actions": [],
  "last_actions_shown": [],
  "last_report": "",
  "last_report_agent": null,
  "last_report_at": null,
  "last_session": {
    "agent": "claude-code",
    "ended": false,
    "session": "session-a"
  },
  "latest_request": "",
  "next_action": "The new task starts with this goal.",
  "started": "2026-10-14T12:00:01Z",
  "status": "active",
  "steering": [],
  "stuck": null,
  "summary": null,
  "task_id": "t_20261014_120001",
  "unknown_exit": [],
  "updated": "2026-10-14T12:00:03Z",
  "usage": {},
  "v": 1
}
