{
  "agents": [
    {
      "agent": "claude-code",
      "session": "S1",
      "transcript": null,
      "turns": 1
    }
  ],
  "decisions": [
    "Keep the public API unchanged"
  ],
  "failing": {
    "command": "python3 -c \"raise SystemExit(7)\"",
    "exit": 7,
    "tail": "Exit code 7"
  },
  "files_touched": [
    "hello.py"
  ],
  "git": null,
  "goal": "Reply OK. This scratch request records an authentication failure using a deliberately invalid test credential.",
  "handoffs": [],
  "interrupted": null,
  "last_actions": [
    "Ran python3 -c \"raise SystemExit(7)\" (exit 7)",
    "Ran python3 hello.py (exit 0)",
    "Wrote hello.py"
  ],
  "last_session": {
    "agent": "claude-code",
    "ended": true,
    "session": "S1"
  },
  "next_action": "Make `python3 -c \"raise SystemExit(7)\"` pass.",
  "notes": [
    {
      "text": "Staging is flaky",
      "type": "warning"
    }
  ],
  "plan": [
    {
      "state": "doing",
      "step": "Implement hello.py"
    },
    {
      "state": "todo",
      "step": "Validate output"
    }
  ],
  "started": "2026-10-17T21:03:29.078181Z",
  "status": "paused",
  "steering": [],
  "task_id": "t_20261017_210329078181",
  "unknown_exit": [],
  "updated": "2026-10-17T21:03:29.108829Z",
  "v": 1
}
