{
  "agents": [
    {
      "agent": "codex",
      "session": "01a13ff8-64b4-7c61-89ae-de023be02d48",
      "transcript": null,
      "turns": 0
    },
    {
      "agent": "codex",
      "session": "01a13ff9-5e3e-7dc0-988c-0a7dbf39cae7",
      "transcript": "~/.codex/sessions/2026/10/15/rollout-2026-10-15T17-31-14-01a13ff9-5e3e-7dc0-988c-0a7dbf39cae7.jsonl",
      "turns": 4
    },
    {
      "agent": "claude-code",
      "session": "8e60730e-eaa3-44d1-b7b4-a6abe7d13687",
      "transcript": "~/.claude/projects/-private-tmp-aa-codex/8e60730e-eaa3-44d1-b7b4-a6abe7d13687.jsonl",
      "turns": 1
    },
    {
      "agent": "codex",
      "session": "01a1400a-a584-70b3-b87f-b1e4399f3c8d",
      "transcript": "~/.codex/sessions/2026/10/15/rollout-2026-10-15T17-50-07-01a1400a-a584-70b3-b87f-b1e4399f3c8d.jsonl",
      "turns": 1
    }
  ],
  "decisions": [],
  "failing": {
    "command": "python3 -c \"raise SystemExit(7)\"",
    "exit": 7,
    "tail": ""
  },
  "files_touched": [
    "hello.py"
  ],
  "git": {
    "branch": "master",
    "commits_since_start": 0,
    "diffstat": "",
    "dirty": [
      "hello.py"
    ],
    "head": null,
    "untracked": [
      "hello.py"
    ]
  },
  "goal": "Use your update_plan tool to make exactly this 3-step plan: \"Write hello.py\", \"Run it\", \"Add a failing check\". Then do step 1 only: create hello.py that prints \"hello autosave\".",
  "handoffs": [
    {
      "at": "2026-10-15T14:37:26.588835Z",
      "from": "codex",
      "reason": "paused",
      "to": "claude-code"
    },
    {
      "at": "2026-10-15T14:50:16.371240Z",
      "from": "claude-code",
      "reason": "paused",
      "to": "codex"
    }
  ],
  "interrupted": null,
  "last_actions": [
    "Ran python3 -c \"raise SystemExit(7)\" (exit 7)",
    "Ran python3 hello.py (exit 0)",
    "Edited hello.py"
  ],
  "last_session": {
    "agent": "codex",
    "ended": true,
    "session": "01a1400a-a584-70b3-b87f-b1e4399f3c8d"
  },
  "next_action": "Make `python3 -c \"raise SystemExit(7)\"` pass.",
  "plan": [
    {
      "state": "done",
      "step": "Write hello.py"
    },
    {
      "state": "done",
      "step": "Run it"
    },
    {
      "state": "todo",
      "step": "Add a failing check"
    }
  ],
  "started": "2026-10-15T14:29:40.592291Z",
  "status": "paused",
  "steering": [
    "Run python3 hello.py. Then run python3 -c \"raise SystemExit(7)\" and stop there; do not fix it.",
    "What did the agent-autosave context at session start tell you?"
  ],
  "task_id": "t_20261015_142940592291",
  "unknown_exit": [],
  "updated": "2026-10-15T14:51:24.439853Z",
  "v": 1
}
