{
  "agents": [
    {
      "agent": "claude-code",
      "session": "session-a",
      "transcript": null,
      "turns": 4
    }
  ],
  "checks": [
    {
      "at": "2026-10-14T12:00:02Z",
      "command": "pytest",
      "exit": 1
    }
  ],
  "decisions": [],
  "failing": {
    "command": "pytest",
    "exit": 1,
    "tail": ""
  },
  "files_edited": [],
  "files_read": [],
  "files_touched": [],
  "git": null,
  "goal": "Build a reliable portable autosave compiler.",
  "handoffs": [],
  "interrupted": null,
  "last_actions": [
    "Ran pytest (exit 1)"
  ],
  "last_actions_shown": [
    "Ran pytest (exit 1)"
  ],
  "last_report": "",
  "last_report_agent": null,
  "last_report_at": null,
  "last_session": {
    "agent": "claude-code",
    "ended": false,
    "session": "session-a"
  },
  "latest_request": "",
  "next_action": "Make `pytest` pass.",
  "plan": [
    {
      "state": "done",
      "step": "Implement compiler"
    }
  ],
  "started": "2026-10-14T12:00:00Z",
  "status": "active",
  "steering": [],
  "stuck": null,
  "summary": null,
  "task_id": "t_20261014_120000000000",
  "unknown_exit": [],
  "updated": "2026-10-14T12:00:03Z",
  "usage": {},
  "v": 1
}
