{
  "agents": [
    {
      "agent": "claude-code",
      "session": "S2",
      "transcript": null,
      "turns": 1
    }
  ],
  "decisions": [],
  "failing": {
    "command": "python3 -c \"raise SystemExit(7)\"",
    "exit": 7,
    "tail": "Exit code 7"
  },
  "files_touched": [],
  "git": {
    "branch": "master",
    "commits_since_start": 0,
    "diffstat": "",
    "dirty": [],
    "head": null,
    "untracked": []
  },
  "goal": "Reply OK. This scratch request records an authentication failure using a deliberately invalid test credential.",
  "handoffs": [],
  "interrupted": null,
  "last_actions": [
    "Ran python3 -c \"raise SystemExit(7)\" (exit 7)",
    "Ran python3 hello.py (exit 0)"
  ],
  "last_session": {
    "agent": "claude-code",
    "ended": false,
    "session": "S2"
  },
  "next_action": "Make `python3 -c \"raise SystemExit(7)\"` pass.",
  "started": "2026-10-17T21:03:29.110466Z",
  "status": "active",
  "steering": [],
  "task_id": "t_20261017_210329110466",
  "unknown_exit": [],
  "updated": "2026-10-17T21:03:29.126297Z",
  "v": 1
}
